{"contributor":{"conflictOfInterest":"none","githubLogin":"Sunnyone1234"},"createdAt":"2026-07-23T22:05:55.255Z","declarations":{"containsNoPersonalData":true,"licenseAccepted":"CC-BY-4.0","physicalDevice":true,"publicMetadataReviewed":true,"rankingNotGuaranteed":true,"rawEvidenceUnmodified":true},"schemaVersion":"power-submission-1.0.0-draft.1","sourceResult":{"path":"result.json","schemaVersion":"power-evidence-envelope-1.0.0-draft.1","sha256":"49e9c7bbaf810b49fbb5380473d3664e2690572cc63534cdb9832751690de6e1"},"submissionID":"1913E0FE-050A-4CF6-B74E-8397A20DB886"}